{
  "kommunenummer": "1201",
  "kommunenavn": "Bergen",
  "bydelsnummer": "02",
  "bydelsnavn": "Bergenhus",
  "melder": {
    "fnr": "22078347825",
    "personnavn": "Navnesen Navn Mellomnavn",
    "rolle": "Lærer",
    "telefonnummer": "99999999",
    "epost": "lærer@skole.no",
    "virksomhet": {
      "navn": "Lærerskolen",
      "orgnr": "123455789",
      "adresse": {
        "adresselinje1": "Rosenkrantzgaten 3",
        "adresselinje2": "",
        "adresselinje3": "",
        "postnummer": "5003",
        "poststed": "Bergen"
      }
    }
  },
  "barn": [
    {
      "fnr": "28071364498",
      "ufoedt": false,
      "personnavn": "Barn Barnesen",
      "telefonnummer": "12121212",
      "relasjon": "Lærer",
      "adresse": {
        "adresselinje1": "Rådhusgaten 10",
        "adresselinje2": "",
        "adresselinje3": "",
        "postnummer": "5020",
        "poststed": "Bergen"
      },
      "orientert": false,
      "orientertGrunn": "Synes det er vanskelig å snakke om dette."
    },
    {
      "fnr": "16081688781",
      "ufoedt": false,
      "personnavn": "Bare Barnet",
      "telefonnummer": "13131313",
      "relasjon": "Lærer til søsteren",
      "adresse": {
        "adresselinje1": "Rådhusgaten 10",
        "adresselinje2": "",
        "adresselinje3": "",
        "postnummer": "5020",
        "poststed": "Bergen"
      },
      "orientert": false,
      "orientertGrunn": "Synes det er vanskelig å snakke om dette."
    }
  ],
  "foresatte": [
    {
      "personnavn": "Foresatt Foresatt",
      "telefonnummer": "45444342",
      "orientert": true,
      "orientertGrunn": ""
    }
  ],
  "behovForTolk": "Nei, de snakker norsk.",
  "andreHjelpeinstanser": "Nei, ikke vært i kontakt med andre hjelpeinstanser.",
  "melding": {
    "melding": "Her kommer selve innholdet i bekymringsmeldingen!",
    "historie": "Her kommer selve historien i bekymringsmeldingen!"
  }
}
